term_name,class_name,term_ns_name,term_iri,term_version_iri,label,definition,usage,notes,examples,type
Address,Address,ltc:Address,http://rs.tdwg.org/ltc/terms/Address,http://rs.tdwg.org/ltc/terms/version/Address-2023-08-01,Address,A physical address for an organisational unit or person.,,,,http://www.w3.org/2000/01/rdf-schema#Class
addressCountry,Address,schema:addressCountry,https://schema.org/addressCountry,,Address Country,"The country. For example, USA. You can also provide the two-letter ISO 3166-1 alpha-2 country code.",,Recommended best practice is to use a controlled vocabulary -- e.g. current ISO 3166 Country Codes.,"`Denmark`, `DK`, `Colombia`, `CO`, `España`, `ES`",http://www.w3.org/1999/02/22-rdf-syntax-ns#Property
addressLocality,Address,schema:addressLocality,https://schema.org/addressLocality,,Address Locality,"The locality in which the street address is, and which is in the region. For example, Mountain View.",The locality in which the address is located. AddressLocality is a more specific geographic area than addressRegion.,,"`Holzminden`, `Araçatuba`, `Ga-Segonyana`, `Mountain View`, `Coventry`, `Tokyo`",http://www.w3.org/1999/02/22-rdf-syntax-ns#Property
addressRegion,Address,schema:addressRegion,https://schema.org/addressRegion,,Address Region,"The region in which the locality is, and which is in the country. For example, California or another appropriate first-level Administrative division.",,,"`Missoula`, `Los Lagos`, `Mataró`, `Guangdong`",http://www.w3.org/1999/02/22-rdf-syntax-ns#Property
addressType,Address,ltc:addressType,http://rs.tdwg.org/ltc/terms/addressType,http://rs.tdwg.org/ltc/terms/version/addressType-2023-08-01,Address Type,"A person or organization can have different addresses, for different purposes. For example, a postal address, a loan address, an address for visits and so on. This property is used to specify the kind of address.",,,"`Physical`, `Postal`, `Loans`, `Visits`, `Home`, `Work`, `Main`",http://www.w3.org/1999/02/22-rdf-syntax-ns#Property
hasIdentifier,Address,ltc:hasIdentifier,http://rs.tdwg.org/ltc/terms/hasIdentifier,http://rs.tdwg.org/ltc/terms/version/hasIdentifier-2023-08-01,Has Identifier,This property refers to one or more related instances of the Identifier class.,,,,http://www.w3.org/1999/02/22-rdf-syntax-ns#Property
postalCode,Address,schema:postalCode,https://schema.org/postalCode,,Postal Code,"The postal code. For example, 94043.",,,"`32308`, `SW7 5HD`, `10115`, `3080`",http://www.w3.org/1999/02/22-rdf-syntax-ns#Property
postOfficeBoxNumber,Address,schema:postOfficeBoxNumber,https://schema.org/postOfficeBoxNumber,,Post Office Box Number,The post office box number for PO box addresses.,,,`PO Box 7169`,http://www.w3.org/1999/02/22-rdf-syntax-ns#Property
streetAddress,Address,schema:streetAddress,https://schema.org/streetAddress,,Street Address,"The street address. For example, 1600 Amphitheatre Pkwy.",,,"`Invalidenstraße 43`, `1400 S. Du Sable Lake Shore Dr`, `960 Carling Avenue`",http://www.w3.org/1999/02/22-rdf-syntax-ns#Property
ChronometricAge,ChronometricAge,ltc:ChronometricAge,http://rs.tdwg.org/ltc/terms/ChronometricAge,http://rs.tdwg.org/ltc/terms/version/ChronometricAge-2023-08-01,Chronometric Age,The age of a specimen or related materials that is generated from a dating assay.,,"To represent a single age, enter the same value in both earliestChronometricAge and latestChronometricAge. Leaving one or both of these fields blank indicates that the value is unknown, has yet to be recorded or is not applicable to the material being described. We recommend that you do not use this class to indicate chronostratigraphy: it is intended to be used to reflect a chronometric age or range of ages determined via one or more named analytical protocols, methods or techniques.",,http://www.w3.org/2000/01/rdf-schema#Class
chronometricAgeProtocol,ChronometricAge,chrono:chronometricAgeProtocol,http://rs.tdwg.org/chrono/terms/chronometricAgeProtocol,,Chronometric Age Protocol,A description of or reference to the methods used to determine the chronometric age.,,,"`Radiocarbon dating using an Accelerator Mass Spectrometry`, `Pb-Pb Dating`, `41Ca - 41K Chronometer`, `U-Pb Dating using a Thermal Ionization Mass Spectrometer`, `U-Pb Radiometric Dating`, `Thermoluminescence`, `Paleomagnetism`, `Pb-Pb Chronometer as described in Amelin et al. (2002) Science 297, 1678-1683`",http://www.w3.org/1999/02/22-rdf-syntax-ns#Property
chronometricAgeRemarks,ChronometricAge,chrono:chronometricAgeRemarks,http://rs.tdwg.org/chrono/terms/chronometricAgeRemarks,,Chronometric Age Remarks,Notes or comments about the ChronometricAge.,,,"`Beta Analytic number: 323913` `One of the Crassostrea virginica right valve specimens from North Midden Feature 17 was chosen for AMS dating, but it is unclear exactly which specimen it was.`",http://www.w3.org/1999/02/22-rdf-syntax-ns#Property
chronometricAgeUncertaintyInYears,ChronometricAge,chrono:chronometricAgeUncertaintyInYears,http://rs.tdwg.org/chrono/terms/chronometricAgeUncertaintyInYears,,Chronometric Age Uncertainty In Years,The temporal uncertainty of the earliestChronometricAge and latestChronometicAge in years.,,The expected unit for this field is years. The value in this field is number of years before and after the values given in the earliest and latest chronometric age fields within which the actual values are estimated to be.,`100`,http://www.w3.org/1999/02/22-rdf-syntax-ns#Property
earliestChronometricAge,ChronometricAge,chrono:earliestChronometricAge,http://rs.tdwg.org/chrono/terms/earliestChronometricAge,,Earliest Chronometric Age,The maximum/earliest/oldest possible age of a specimen as determined by a dating method.,,"The expected unit for this field is years. This field, if populated, must have an associated earliestChronometricAgeReferenceSystem.",`100`,http://www.w3.org/1999/02/22-rdf-syntax-ns#Property
earliestChronometricAgeReferenceSystem,ChronometricAge,chrono:earliestChronometricAgeReferenceSystem,http://rs.tdwg.org/chrono/terms/earliestChronometricAgeReferenceSystem,,Earliest Chronometric Age Reference System,The reference system associated with the earliestChronometricAge.,,,"`kya`, `mya`, `BP`, `AD`, `BCE`",http://www.w3.org/1999/02/22-rdf-syntax-ns#Property
hasIdentifier,ChronometricAge,ltc:hasIdentifier,http://rs.tdwg.org/ltc/terms/hasIdentifier,http://rs.tdwg.org/ltc/terms/version/hasIdentifier-2023-08-01,Has Identifier,This property refers to one or more related instances of the Identifier class.,,,,http://www.w3.org/1999/02/22-rdf-syntax-ns#Property
hasMeasurementOrFact,ChronometricAge,ltc:hasMeasurementOrFact,http://rs.tdwg.org/ltc/terms/hasMeasurementOrFact,http://rs.tdwg.org/ltc/terms/version/hasMeasurementOrFact-2023-08-01,Has Measurement Or Fact,This property refers to one or more related instances of the MeasurementOrFact class.,,,,http://www.w3.org/1999/02/22-rdf-syntax-ns#Property
hasReference,ChronometricAge,ltc:hasReference,http://rs.tdwg.org/ltc/terms/hasReference,http://rs.tdwg.org/ltc/terms/version/hasReference-2023-08-01,Has Reference,This property refers to one or more related instances of the Reference class.,,,,http://www.w3.org/1999/02/22-rdf-syntax-ns#Property
latestChronometricAge,ChronometricAge,chrono:latestChronometricAge,http://rs.tdwg.org/chrono/terms/latestChronometricAge,,Latest Chronometric Age,The minimum/latest/youngest possible age of a specimen as determined by a dating method.,The minimum/latest/youngest possible age of an object in the collection as determined by a dating method.,"The expected unit for this field is years. This field, if populated, must have an associated latestChronometricAgeReferenceSystem.",`27`,http://www.w3.org/1999/02/22-rdf-syntax-ns#Property
latestChronometricAgeReferenceSystem,ChronometricAge,chrono:latestChronometricAgeReferenceSystem,http://rs.tdwg.org/chrono/terms/latestChronometricAgeReferenceSystem,,Latest Chronometric Age Reference System,The reference system associated with the latestChronometricAge.,,Recommended best practice is to use a controlled vocabulary.,"`kya`, `mya`, `BP`, `AD`, `BCE`",http://www.w3.org/1999/02/22-rdf-syntax-ns#Property
verbatimChronometricAge,ChronometricAge,chrono:verbatimChronometricAge,http://rs.tdwg.org/chrono/terms/verbatimChronometricAge,,Verbatim Chronometric Age,"The verbatim age for a specimen, whether reported by a dating assay, associated references, or legacy information.","""The verbatim age for the objects in the collection, whether reported by a dating assay, associated references, or legacy information.""","For example, this could be the radiocarbon age as given in an AMS dating report. This could also be simply what is reported as the age of a specimen in legacy collections data.",`27 BC to 14 AD`,http://www.w3.org/1999/02/22-rdf-syntax-ns#Property
CollectionStatusHistory,CollectionStatusHistory,ltc:CollectionStatusHistory,http://rs.tdwg.org/ltc/terms/CollectionStatusHistory,http://rs.tdwg.org/ltc/terms/version/CollectionStatusHistory-2023-08-01,Collection Status History,A record of current and past statuses of the object group and the reason for status changes.,,"Use this class to record the history of and reason for changes in the status of the described collection. Types of status described by this class may, for example, include ownership, management, accessibility or accrual policy over time. Dates reflecting the start and end of the status described by this class should be recorded using an instance of TemporalCoverage. If temporalCoverageEndDateTime is empty, the status should be inferred to be the current status of the collection.",,http://www.w3.org/2000/01/rdf-schema#Class
hasIdentifier,CollectionStatusHistory,ltc:hasIdentifier,http://rs.tdwg.org/ltc/terms/hasIdentifier,http://rs.tdwg.org/ltc/terms/version/hasIdentifier-2023-08-01,Has Identifier,This property refers to one or more related instances of the Identifier class.,,,,http://www.w3.org/1999/02/22-rdf-syntax-ns#Property
hasMeasurementOrFact,CollectionStatusHistory,ltc:hasMeasurementOrFact,http://rs.tdwg.org/ltc/terms/hasMeasurementOrFact,http://rs.tdwg.org/ltc/terms/version/hasMeasurementOrFact-2023-08-01,Has Measurement Or Fact,This property refers to one or more related instances of the MeasurementOrFact class.,,,,http://www.w3.org/1999/02/22-rdf-syntax-ns#Property
hasReference,CollectionStatusHistory,ltc:hasReference,http://rs.tdwg.org/ltc/terms/hasReference,http://rs.tdwg.org/ltc/terms/version/hasReference-2023-08-01,Has Reference,This property refers to one or more related instances of the Reference class.,,,,http://www.w3.org/1999/02/22-rdf-syntax-ns#Property
hasTemporalCoverage,CollectionStatusHistory,ltc:hasTemporalCoverage,http://rs.tdwg.org/ltc/terms/hasTemporalCoverage,http://rs.tdwg.org/ltc/terms/version/hasTemporalCoverage-2023-08-01,Has Temporal Coverage,This property refers to one or more related instances of the TemporalCoverage class.,,,,http://www.w3.org/1999/02/22-rdf-syntax-ns#Property
status,CollectionStatusHistory,ltc:status,http://rs.tdwg.org/ltc/terms/status,http://rs.tdwg.org/ltc/terms/version/status-2023-08-01,Status,The development status of the collection during a specified period.,,The values/vocabularies for a status are predicated by the statusType. The in the examples mentioned terms are a cumulative list of terms associated with several different statusTypes.,"`Complete`, `In part`, `Developing`, `Closed`, `Active growth`, `Consumable`, `Decreasing`, `Lost`, `Missing`, `Passive growth`, `Static`",http://www.w3.org/1999/02/22-rdf-syntax-ns#Property
statusChangeReason,CollectionStatusHistory,ltc:statusChangeReason,http://rs.tdwg.org/ltc/terms/statusChangeReason,http://rs.tdwg.org/ltc/terms/version/statusChangeReason-2023-08-01,Status Change Reason,An explanation of why the collection transitioned to the value set in the status property.,,statusChangeReason should be aligned with the value of statusType.,"`Pest infestation`, `Exchange`, `Transfer`, `Return to country of origin`, `Worldwide pandemic`, `moved to secure off-site storage`, `reorganisation, no access from 2020-2023`",http://www.w3.org/1999/02/22-rdf-syntax-ns#Property
statusType,CollectionStatusHistory,ltc:statusType,http://rs.tdwg.org/ltc/terms/statusType,http://rs.tdwg.org/ltc/terms/version/statusType-2023-08-01,Status Type,A top-level classification of the different categories of status that can be applied to the collection.,,statusType forms the top level of a two-level hierarchy with the status property. Recommended best practice is to use a controlled vocabulary.,"`Stewardship`, `Accessibility`, `Completeness`, `Growth Status`, `Organisational`",http://www.w3.org/1999/02/22-rdf-syntax-ns#Property
ContactDetail,ContactDetail,ltc:ContactDetail,http://rs.tdwg.org/ltc/terms/ContactDetail,http://rs.tdwg.org/ltc/terms/version/ContactDetail-2023-08-01,Contact Detail,Details of a method by which an entity such as a Person or OrganisationalUnit may be contacted.,,"The Address class should be used to store physical or postal addresses. For all other types of contact details, this class should be used.",,http://www.w3.org/2000/01/rdf-schema#Class
contactDetailCategory,ContactDetail,ltc:contactDetailCategory,http://rs.tdwg.org/ltc/terms/contactDetailCategory,http://rs.tdwg.org/ltc/terms/version/contactDetailCategory-2023-08-01,Contact Detail Category,The method of contact to which the contact detail applies.,,Recommended practice is to use a controlled vocabulary.,"`Email`, `Phone (mobile)`, `Phone (home)`, `Twitter handle`, `GitHub handle`",http://www.w3.org/1999/02/22-rdf-syntax-ns#Property
contactDetailFunction,ContactDetail,ltc:contactDetailFunction,http://rs.tdwg.org/ltc/terms/contactDetailFunction,http://rs.tdwg.org/ltc/terms/version/contactDetailFunction-2023-08-01,Contact Detail Function,A brief label describing the nature of the enquiry or enquiries that are appropriate to direct to the contact detail.,,,"`Loan requests`, `General enquiries`, `Data issues`",http://www.w3.org/1999/02/22-rdf-syntax-ns#Property
contactDetailValue,ContactDetail,ltc:contactDetailValue,http://rs.tdwg.org/ltc/terms/contactDetailValue,http://rs.tdwg.org/ltc/terms/version/contactDetailValue-2023-08-01,Contact Detail Value,"The value of the contact detail, such as the phone number or email address.",,,"`01234 567891`, `someone@example.org`, `@github_user`",http://www.w3.org/1999/02/22-rdf-syntax-ns#Property
hasIdentifier,ContactDetail,ltc:hasIdentifier,http://rs.tdwg.org/ltc/terms/hasIdentifier,http://rs.tdwg.org/ltc/terms/version/hasIdentifier-2023-08-01,Has Identifier,This property refers to one or more related instances of the Identifier class.,,,,http://www.w3.org/1999/02/22-rdf-syntax-ns#Property
EcologicalContext,EcologicalContext,ltc:EcologicalContext,http://rs.tdwg.org/ltc/terms/EcologicalContext,http://rs.tdwg.org/ltc/terms/version/EcologicalContext-2023-08-01,Ecological Context,"The ecological and/or biogeographic classification of the region from which objects associated with the ObjectGroup were collected, or where an Event took place.",,"There is some conceptual overlap with the GeographicContext class with respect to geographic locations. This class should be used for biogeographic and ecological concepts, whereas for physical, political and administrative geographic locations, the GeographicContext class is more appropriate. Specific information about the habitat and ecological conditions that applied at the time that an event took place should be recorded in the `habitat` property of the Event class.",,http://www.w3.org/2000/01/rdf-schema#Class
biogeographicRealm,EcologicalContext,ltc:biogeographicRealm,http://rs.tdwg.org/ltc/terms/biogeographicRealm,http://rs.tdwg.org/ltc/terms/version/biogeographicRealm-2023-08-01,Biogeographic Realm,"The broadest biogeographic division of Earth's land and marine surface, based on distributional patterns of terrestrial and marine organisms.",,"This term may commonly be used in a biogeographic hierarchy above marineProvince (marine only), ecoregion and ecosystem. It is recommended to use controlled vocabularies such as those adopted by the World Wildlife Fund (WWF) / Global 200 (Olson et at. 1998). ","`Afrotropical`, `Australasian`, `Indomalayan`, `Nearctic`, `Arctic`, `Temperate Northern Atlantic`, `Temperate Northern Pacific`",http://www.w3.org/1999/02/22-rdf-syntax-ns#Property
biome,EcologicalContext,ltc:biome,http://rs.tdwg.org/ltc/terms/biome,http://rs.tdwg.org/ltc/terms/version/biome-2023-08-01,Biome,A biogeographical unit consisting of a biological community that has formed in response to the physical environment in which they are found and a shared regional climate.,,"This property can be used to record terrestrial, freshwater and marine biomes. It is recommended to use controlled vocabularies such as those adopted by the World Wildlife Fund (WWF) / Global 200 (Olson et at. 1998). ","`Deserts and xeric shrublands`, `Tropical and subtropical moist broadleaf forests`, `Open sea`, `Deep sea`, `Littoral/Intertidal zone`, `Salt marsh`, `Estuaries`, `Large lakes`, `Large river deltas`, `Polar freshwaters`, `Tropical and subtropical coastal rivers`, `Tropical and subtropical floodplain rivers and wetlands`",http://www.w3.org/1999/02/22-rdf-syntax-ns#Property
biomeType,EcologicalContext,ltc:biomeType,http://rs.tdwg.org/ltc/terms/biomeType,http://rs.tdwg.org/ltc/terms/version/biomeType-2023-08-01,Biome Type,A top level classification of the type of biome from which objects were collected or where an event took place.,,"The biomeType is positioned at a level between the biosphere (the global sum of all ecosystems on Earth) and the more detailed terrestrial, marine and freshwater biomes. The latter should be recorded using the EcologicalContext.biome property.","`Terrestrial`, `Marine`, `Freshwater`",http://www.w3.org/1999/02/22-rdf-syntax-ns#Property
bioregion,EcologicalContext,ltc:bioregion,http://rs.tdwg.org/ltc/terms/bioregion,http://rs.tdwg.org/ltc/terms/version/bioregion-2023-08-01,Bioregion,"An ecologically and geographically defined area that is smaller than a biogeographic realm, but larger than an ecoregion or an ecosystem.",,"This is analagous with the marine province concept for marine regions. It is recommended to use controlled vocabularies such as those adopted by the World Wildlife Fund (WWF) / Global 200 (Olson et at. 1998), from which this concept originated. ","`Western Africa and Sahel`, `New Guinea and Melanesia`, `Indian subcontinent`, `South China Sea`, `Mediterranean Sea`, `Central Indian Ocean Islands`",http://www.w3.org/1999/02/22-rdf-syntax-ns#Property
ecoregion,EcologicalContext,ltc:ecoregion,http://rs.tdwg.org/ltc/terms/ecoregion,http://rs.tdwg.org/ltc/terms/version/ecoregion-2023-08-01,Ecoregion,"An ecologically and geographically defined area that is smaller than a bioregion, which in turn is smaller than a biogeographic realm. Ecoregions cover relatively large areas of land or water, and contain characteristic, geographically distinct assemblages of natural communities and species.",,It is recommended to use controlled vocabularies such as those adopted by the World Wildlife Fund (WWF) / Global 200 (Olson et at. 1998).,"`Albertine Rift montane forests`, `Atlantic Equatorial coastal forests`, `Irrawaddy freshwater swamp forests`, `Adriatic Sea`, `Cortezian`, `Ningaloo`, `Ross Sea`",http://www.w3.org/1999/02/22-rdf-syntax-ns#Property
ecosystem,EcologicalContext,ltc:ecosystem,http://rs.tdwg.org/ltc/terms/ecosystem,http://rs.tdwg.org/ltc/terms/version/ecosystem-2023-08-01,Ecosystem,"A specific kind of ecological classification that considers all four elements of the definition of ecosystems: a biotic component, an abiotic complex, the interactions between and within them, and the physical space that they occupy.",,,"`Orjen, vegetation belt between 1,100 and 1,450 m, Oromediterranean zone, nemoral zone (temperate zone)`",http://www.w3.org/1999/02/22-rdf-syntax-ns#Property
habitat,EcologicalContext,ltc:habitat,http://rs.tdwg.org/ltc/terms/habitat,http://rs.tdwg.org/ltc/terms/version/habitat-2023-08-01,Habitat,A description of the type of environment in which an organism lives.,,,"`oak savanna`, `pre-cordilleran steppe`",http://www.w3.org/1999/02/22-rdf-syntax-ns#Property
hasIdentifier,EcologicalContext,ltc:hasIdentifier,http://rs.tdwg.org/ltc/terms/hasIdentifier,http://rs.tdwg.org/ltc/terms/version/hasIdentifier-2023-08-01,Has Identifier,This property refers to one or more related instances of the Identifier class.,,,,http://www.w3.org/1999/02/22-rdf-syntax-ns#Property
hasMeasurementOrFact,EcologicalContext,ltc:hasMeasurementOrFact,http://rs.tdwg.org/ltc/terms/hasMeasurementOrFact,http://rs.tdwg.org/ltc/terms/version/hasMeasurementOrFact-2023-08-01,Has Measurement Or Fact,This property refers to one or more related instances of the MeasurementOrFact class.,,,,http://www.w3.org/1999/02/22-rdf-syntax-ns#Property
hasReference,EcologicalContext,ltc:hasReference,http://rs.tdwg.org/ltc/terms/hasReference,http://rs.tdwg.org/ltc/terms/version/hasReference-2023-08-01,Has Reference,This property refers to one or more related instances of the Reference class.,,,,http://www.w3.org/1999/02/22-rdf-syntax-ns#Property
Event,Event,ltc:Event,http://rs.tdwg.org/ltc/terms/Event,http://rs.tdwg.org/ltc/terms/version/Event-2023-08-01,Event,An action that occurs at some location during some time.,,Derived from dwc Class event (http://rs.tdwg.org/dwc/terms/version/Event-2018-09-06). This class has been defined under the ltc namespace because it only has a subset of the properties of DwC:Event. All ltc:Event properties are borrowed from and reference the dwc namespace. Examples of an Event include: A specimen collection process. A camera trap image capture. A marine trawl.,,http://www.w3.org/2000/01/rdf-schema#Class
eventName,Event,ltc:eventName,http://rs.tdwg.org/ltc/terms/eventName,http://rs.tdwg.org/ltc/terms/version/eventName-2023-08-01,Event Name,The name commonly used to identify or refer to the event.,,,"`Trawl 3.42`, ` Voyage of the Rattlesnake 1846-1850`, `Donner-Reed Party`",http://www.w3.org/1999/02/22-rdf-syntax-ns#Property
hasEcologicalContext,Event,ltc:hasEcologicalContext,http://rs.tdwg.org/ltc/terms/hasEcologicalContext,http://rs.tdwg.org/ltc/terms/version/hasEcologicalContext-2023-08-01,Has Ecological Context,This property refers to one or more related instances of the EcologicalContext class.,,,,http://www.w3.org/1999/02/22-rdf-syntax-ns#Property
hasGeographicContext,Event,ltc:hasGeographicContext,http://rs.tdwg.org/ltc/terms/hasGeographicContext,http://rs.tdwg.org/ltc/terms/version/hasGeographicContext-2023-08-01,Has Geographic Context,This property refers to one or more related instances of the GeographicContext class.,,,,http://www.w3.org/1999/02/22-rdf-syntax-ns#Property
hasIdentifier,Event,ltc:hasIdentifier,http://rs.tdwg.org/ltc/terms/hasIdentifier,http://rs.tdwg.org/ltc/terms/version/hasIdentifier-2023-08-01,Has Identifier,This property refers to one or more related instances of the Identifier class.,,,,http://www.w3.org/1999/02/22-rdf-syntax-ns#Property
hasMeasurementOrFact,Event,ltc:hasMeasurementOrFact,http://rs.tdwg.org/ltc/terms/hasMeasurementOrFact,http://rs.tdwg.org/ltc/terms/version/hasMeasurementOrFact-2023-08-01,Has Measurement Or Fact,This property refers to one or more related instances of the MeasurementOrFact class.,,,,http://www.w3.org/1999/02/22-rdf-syntax-ns#Property
hasParentEvent,Event,ltc:hasParentEvent,http://rs.tdwg.org/ltc/terms/hasParentEvent,http://rs.tdwg.org/ltc/terms/version/hasParentEvent-2023-08-01,Has Parent Event,This property refers to one or more related parent instances of the Event class.,This term should only contain Events that can be considered to be a parent of the current instance.,,,http://www.w3.org/1999/02/22-rdf-syntax-ns#Property
hasPersonRole,Event,ltc:hasPersonRole,http://rs.tdwg.org/ltc/terms/hasPersonRole,http://rs.tdwg.org/ltc/terms/version/hasPersonRole-2023-08-01,Has Person Role,This property refers to one or more related instances of the PersonRole class.,,,,http://www.w3.org/1999/02/22-rdf-syntax-ns#Property
hasReference,Event,ltc:hasReference,http://rs.tdwg.org/ltc/terms/hasReference,http://rs.tdwg.org/ltc/terms/version/hasReference-2023-08-01,Has Reference,This property refers to one or more related instances of the Reference class.,,,,http://www.w3.org/1999/02/22-rdf-syntax-ns#Property
hasTemporalCoverage,Event,ltc:hasTemporalCoverage,http://rs.tdwg.org/ltc/terms/hasTemporalCoverage,http://rs.tdwg.org/ltc/terms/version/hasTemporalCoverage-2023-08-01,Has Temporal Coverage,This property refers to one or more related instances of the TemporalCoverage class.,,,,http://www.w3.org/1999/02/22-rdf-syntax-ns#Property
samplingProtocol,Event,dwc:samplingProtocol,http://rs.tdwg.org/dwc/terms/samplingProtocol,,Sampling Protocol,"The names of, references to, or descriptions of the methods or protocols used during an Event.",,The primary use of this property is to describe the methods or protocols used to gather objects in the collection.,"`UV light trap`, `mist net`, `bottom trawl`, `ad hoc observation`, `Penguins from space: faecal stains reveal the location of emperor penguin colonies, https://doi.org/10.1111/j.1466-8238.2009.00467.x`, `Takats et al. 2001. Guidelines for Nocturnal Owl Monitoring in North America. Beaverhill Bird Observatory and Bird Studies Canada, Edmonton, Alberta. 32 pp., http://www.bsc-eoc.org/download/Owl.pdf`",http://www.w3.org/1999/02/22-rdf-syntax-ns#Property
verbatimEventDate,Event,dwc:verbatimEventDate,http://rs.tdwg.org/dwc/terms/verbatimEventDate,,Verbatim Event Date,The verbatim original representation of the date and time information for an Event.,,,"`spring 1910`, `Marzo 2002`, `1999-03-XX`, `17IV1934`",http://www.w3.org/1999/02/22-rdf-syntax-ns#Property
