term_name,class_name,term_ns_name,term_iri,term_version_iri,label,definition,usage,notes,examples,type
hasSchemeTerm,LatimerCoreScheme,ltc:hasSchemeTerm,http://rs.tdwg.org/ltc/terms/hasSchemeTerm,http://rs.tdwg.org/ltc/terms/version/hasSchemeTerm-2023-08-01,Has Scheme Term,This property refers to one or more related instances of the SchemeTerm class.,,,,http://www.w3.org/1999/02/22-rdf-syntax-ns#Property
isDistinctObjects,LatimerCoreScheme,ltc:isDistinctObjects,http://rs.tdwg.org/ltc/terms/isDistinctObjects,http://rs.tdwg.org/ltc/terms/version/isDistinctObjects-2023-08-01,Is Distinct Objects,A flag to designate whether a physical object may be described by more than one ObjectGroup within the LatimerCoreScheme.,,"If isDistinctObjects is set to 'true', then no collection object should be covered by more than one object group within the LatimerCoreScheme. This is important for aggregating and reporting on metrics such as object counts, as it prevents any physical object from being counted more than once.","`true`, `false`",http://www.w3.org/1999/02/22-rdf-syntax-ns#Property
schemeName,LatimerCoreScheme,ltc:schemeName,http://rs.tdwg.org/ltc/terms/schemeName,http://rs.tdwg.org/ltc/terms/version/schemeName-2023-08-01,Scheme Name,A short descriptive name given to the LatimerCoreScheme.,,,"`NHM Collections Inventory`, `Index Herbariorum`, `European Darwin Collections`",http://www.w3.org/1999/02/22-rdf-syntax-ns#Property
MeasurementOrFact,MeasurementOrFact,ltc:MeasurementOrFact,http://rs.tdwg.org/ltc/terms/MeasurementOrFact,http://rs.tdwg.org/ltc/terms/version/MeasurementOrFact-2023-08-01,Measurement or Fact,"A measurement of or fact about a class within the standard, or a relationship between the ObjectGroup and an associated class.",,"This class can be used to apply measurements, facts or narratives to the ObjectGroup as a whole, or used to qualify the relationship between the ObjectGroup and an associated attribute. For example, an ObjectGroup may contain 100 objects, of which 40 are from Europe and 60 from Africa. In this example, one MeasurementOrFact (count of 100) would be attached to the ObjectGroup, and one to each of the two relationships between the ObjectGroup and GeographicContext (Europe: count of 40, Africa: count of 60).",,http://www.w3.org/2000/01/rdf-schema#Class
hasIdentifier,MeasurementOrFact,ltc:hasIdentifier,http://rs.tdwg.org/ltc/terms/hasIdentifier,http://rs.tdwg.org/ltc/terms/version/hasIdentifier-2023-08-01,Has Identifier,This property refers to one or more related instances of the Identifier class.,,,,http://www.w3.org/1999/02/22-rdf-syntax-ns#Property
hasReference,MeasurementOrFact,ltc:hasReference,http://rs.tdwg.org/ltc/terms/hasReference,http://rs.tdwg.org/ltc/terms/version/hasReference-2023-08-01,Has Reference,This property refers to one or more related instances of the Reference class.,,,,http://www.w3.org/1999/02/22-rdf-syntax-ns#Property
measurementAccuracy,MeasurementOrFact,dwc:measurementAccuracy,http://rs.tdwg.org/dwc/terms/measurementAccuracy,,Measurement Accuracy,The description of the potential error associated with the measurementValue.,The description of the potential error associated with the measurementValue applied to the collection.,,"`0.01`, `Normal distribution with variation of 2 m`, `Reported`, `Estimated`",http://www.w3.org/1999/02/22-rdf-syntax-ns#Property
measurementDerivation,MeasurementOrFact,ltc:measurementDerivation,http://rs.tdwg.org/ltc/terms/measurementDerivation,http://rs.tdwg.org/ltc/terms/version/measurementDerivation-2023-08-01,Measurement Derivation,"An indicator as to whether the measurement, fact, characteristic, or assertion being applied to the collection was derived from reported figures or aggregated/calculated from underlying data.",,"If there is more detailed information about the method by which a measurement or fact was derived, this should be captured using the measurementMethod property.","`Reported`, `Calculated`",http://www.w3.org/1999/02/22-rdf-syntax-ns#Property
measurementFactText,MeasurementOrFact,ltc:measurementFactText,http://rs.tdwg.org/ltc/terms/measurementFactText,http://rs.tdwg.org/ltc/terms/version/measurementFactText-2023-08-01,Fact or Narrative Text,"The value of the qualitative fact, characteristic, or assertion being made about the collection.",,"This property should also be used for storing textual information about the collection within a particular context, such as narratives or comments about digitisation readiness.","`UV-light`, `Extra large`, `Level 1`, `Re-curation of this collection would be required prior to digitisation, requiring an estimated two weeks of curator time.`",http://www.w3.org/1999/02/22-rdf-syntax-ns#Property
measurementMethod,MeasurementOrFact,dwc:measurementMethod,http://rs.tdwg.org/dwc/terms/measurementMethod,,Measurement Method,"A description of or reference to (publication, URI) the method or protocol used to determine the measurement, fact, characteristic, or assertion.",,,"`DiSSCo MIDS level`, `CD Standard Metric`, `https://doi.org/10.5281/zenodo.3465285`",http://www.w3.org/1999/02/22-rdf-syntax-ns#Property
measurementRemarks,MeasurementOrFact,dwc:measurementRemarks,http://rs.tdwg.org/dwc/terms/measurementRemarks,,Measurement Remarks,Comments or notes accompanying the MeasurementOrFact.,,,"`Does not include on-loan material`, `Footprint includes housing`",http://www.w3.org/1999/02/22-rdf-syntax-ns#Property
measurementType,MeasurementOrFact,dwc:measurementType,http://rs.tdwg.org/dwc/terms/measurementType,,Measurement Type,"The nature of the measurement, fact, characteristic, or assertion.",,Recommended best practice is to use a controlled vocabulary.,"`Imaged Level Percentage`, `Storage Volume`, `Object Count`, `MIDS-0 Object Count`, `Historical narrative`",http://www.w3.org/1999/02/22-rdf-syntax-ns#Property
measurementUnit,MeasurementOrFact,dwc:measurementUnit,http://rs.tdwg.org/dwc/terms/measurementUnit,,Measurement Unit,The units associated with the measurementValue.,,"For some use cases, this property can also be used to reflect the type of value being stored (e.g. a count, or a percentage).","`mm`, `C`, `km`, `ha`, `count`, `percentage`, `category`",http://www.w3.org/1999/02/22-rdf-syntax-ns#Property
measurementValue,MeasurementOrFact,dwc:measurementValue,http://rs.tdwg.org/dwc/terms/measurementValue,,Measurement Value,"The value of the measurement, fact, characteristic, or assertion.",The numeric value of the quantitative measurement being made about the collection.,"In the Collection Description standard, this field is constrained to only accept numeric values in order to better support the aggregation of quantitative metrics. For any non-numeric values, and metrics where the scale is a numeral that cannot be used in any calculations the measurementFactText property should be used instead.","`45`, `20000`, `1`, `14.5`",http://www.w3.org/1999/02/22-rdf-syntax-ns#Property
ObjectClassification,ObjectClassification,ltc:ObjectClassification,http://rs.tdwg.org/ltc/terms/ObjectClassification,http://rs.tdwg.org/ltc/terms/version/ObjectClassification-2023-08-01,Object Classification,"An informal classification of the type of objects within the ObjectGroup, using a hierarchical structure.",,"This class is used to categorise the ObjectGroup according to an informal, self-referential hierarchy. For example, this can be used to create a hierarchy encompassing biological, geological and anthropological collections, where a single formal taxonomy isn't appropriate.",,http://www.w3.org/2000/01/rdf-schema#Class
hasIdentifier,ObjectClassification,ltc:hasIdentifier,http://rs.tdwg.org/ltc/terms/hasIdentifier,http://rs.tdwg.org/ltc/terms/version/hasIdentifier-2023-08-01,Has Identifier,This property refers to one or more related instances of the Identifier class.,,,,http://www.w3.org/1999/02/22-rdf-syntax-ns#Property
hasMeasurementOrFact,ObjectClassification,ltc:hasMeasurementOrFact,http://rs.tdwg.org/ltc/terms/hasMeasurementOrFact,http://rs.tdwg.org/ltc/terms/version/hasMeasurementOrFact-2023-08-01,Has Measurement Or Fact,This property refers to one or more related instances of the MeasurementOrFact class.,,,,http://www.w3.org/1999/02/22-rdf-syntax-ns#Property
hasObjectClassification,ObjectClassification,ltc:hasObjectClassification,http://rs.tdwg.org/ltc/terms/hasObjectClassification,http://rs.tdwg.org/ltc/terms/version/hasObjectClassification-2023-08-01,Has Object Classification,This property refers to one or more related instances of the ObjectClassification class.,,,,http://www.w3.org/1999/02/22-rdf-syntax-ns#Property
hasReference,ObjectClassification,ltc:hasReference,http://rs.tdwg.org/ltc/terms/hasReference,http://rs.tdwg.org/ltc/terms/version/hasReference-2023-08-01,Has Reference,This property refers to one or more related instances of the Reference class.,,,,http://www.w3.org/1999/02/22-rdf-syntax-ns#Property
isTopParent,ObjectClassification,ltc:isTopParent,http://rs.tdwg.org/ltc/terms/isTopParent,http://rs.tdwg.org/ltc/terms/version/isTopParent-2023-08-01,Is Top Parent,A flag to indicate that the current instance of ObjectClassification is at the top of the hierarchy represented by multiple nested instances of the class.,"""If this term is used, it should be set to `true` in the instance of ObjectClassification which represents the highest level of a hierarchy and `false` in the rest. If the direction of the hierarchy is self-evident or otherwise not notable, this term should not be populated. """,,"`true`, `false`",http://www.w3.org/1999/02/22-rdf-syntax-ns#Property
objectClassificationLevel,ObjectClassification,ltc:objectClassificationLevel,http://rs.tdwg.org/ltc/terms/objectClassificationLevel,http://rs.tdwg.org/ltc/terms/version/objectClassificationLevel-2023-08-01,Object Classification Level,The level of the ObjectClassification in the hierarchy.,,It is up to the user to name the levels to be relevant to the hierarchical classification scheme that they are defining.,"`Domain`, `Discipline`, `Category`",http://www.w3.org/1999/02/22-rdf-syntax-ns#Property
objectClassificationName,ObjectClassification,ltc:objectClassificationName,http://rs.tdwg.org/ltc/terms/objectClassificationName,http://rs.tdwg.org/ltc/terms/version/objectClassificationName-2023-08-01,Object Classification Name,"A short title describing this ObjectClassification as a class, unit or grouping.",,"This is a user-determined name given for classifying their collection. This name, expressing an assigned classification, can be part of a self-referential hierarchy.","`Zoology invertebrates`, `Palaeontology`, `Extra-terrestrial`, `Archaeology`, `Seed plants`, `Birds`, `Agriculture`, `Veterinary`, `Viruses`",http://www.w3.org/1999/02/22-rdf-syntax-ns#Property
ObjectGroup,ObjectGroup,ltc:ObjectGroup,http://rs.tdwg.org/ltc/terms/ObjectGroup,http://rs.tdwg.org/ltc/terms/version/ObjectGroup-2023-08-01,Object Group,An intentionally grouped set of objects with one or more common characteristics.,,,,http://www.w3.org/2000/01/rdf-schema#Class
alternativeCollectionName,ObjectGroup,ltc:alternativeCollectionName,http://rs.tdwg.org/ltc/terms/alternativeCollectionName,http://rs.tdwg.org/ltc/terms/version/alternativeCollectionName-2023-08-01,Alternative Collection Name,One or more short titles different to the one given in ObjectGroup.collectionName used to summarise the collection objects contained within the ObjectGroup.,,,"`Darwin's fossil mammal collection`, `The Hubricht Molluscan Collection`",http://www.w3.org/1999/02/22-rdf-syntax-ns#Property
baseTypeOfObjectGroup,ObjectGroup,ltc:baseTypeOfObjectGroup,http://rs.tdwg.org/ltc/terms/baseTypeOfObjectGroup,http://rs.tdwg.org/ltc/terms/version/baseTypeOfObjectGroup-2023-08-01,Base Type Of Object Group,High-level terms describing the fundamental nature of objects in the ObjectGroup.,,"For natural history collections baseTypeOfObjectGroup describes types of material entities and may constrain the values available in objectType. Notes for ObjectGroups where baseTypeOfObjectGroup is 'InformationArtefact': subsequent ‘type’ properties could include hierarchical Audubon Core/Dublin Core terms – e.g. dc:type (http://purl.org/dc/elements/1.1/type), ac:subtype / ac:subtypeLiteral (http://rs.tdwg.org/ac/terms/subtypeLiteral), or (proposed) ac:3DResourceType.","`MaterialEntity`, `InformationArtefact`, `AbstractConcept`",http://www.w3.org/1999/02/22-rdf-syntax-ns#Property
collectionManagementSystem,ObjectGroup,ltc:collectionManagementSystem,http://rs.tdwg.org/ltc/terms/collectionManagementSystem,http://rs.tdwg.org/ltc/terms/version/collectionManagementSystem-2023-08-01,Collection Management System,The collection management system which is used to hold and manage the primary data for the objects contained within the ObjectGroup.,,"This should reflect the system or database in which the object-level records reside, rather than the source of the Collection Description data.","`Specify 7`, `DINA`, `Axiell EMu`, `Arctos`, `EarthCape`, `BRAHMS`",http://www.w3.org/1999/02/22-rdf-syntax-ns#Property
collectionName,ObjectGroup,ltc:collectionName,http://rs.tdwg.org/ltc/terms/collectionName,http://rs.tdwg.org/ltc/terms/version/collectionName-2023-08-01,Collection Name,A short title that summarises the collection objects contained within the ObjectGroup.,,,"`The Leslie Hubricht Molluscan Collection`, `NHM Algae, Fungi and Plants collection`, `Crustacea – Cirripedes, Decapoda`, `Global Mesozoic and Paleozoic mollusc faunas/samples`",http://www.w3.org/1999/02/22-rdf-syntax-ns#Property
conditionsOfAccess,ObjectGroup,ltc:conditionsOfAccess,http://rs.tdwg.org/ltc/terms/conditionsOfAccess,http://rs.tdwg.org/ltc/terms/version/conditionsOfAccess-2023-08-01,Conditions of Access,Information about who can access the collection being described or an indication of its security status.,,"If available, this should be a URL to a stable policy page. For example, https://www.fieldmuseum.org/science/research/area/fossils-meteorites/fossils-meteorites-policies.",`Open to the public`,http://www.w3.org/1999/02/22-rdf-syntax-ns#Property
degreeOfEstablishment,ObjectGroup,dwc:degreeOfEstablishment,http://rs.tdwg.org/dwc/terms/degreeOfEstablishment,,Degree of Establishment,"The degree to which an Organism survives, reproduces, and expands its range at the given place and time.",,"Some preserved collections are specifically created from cultivated or captive organisms, or perhaps from rare vagrants. Recommended best practice is to use controlled value strings from the controlled vocabulary designated for use with this term, listed at http://rs.tdwg.org/dwc/doc/doe/. For details, refer to https://doi.org/10.3897/biss.3.38084.","`native`, `captive`, `cultivated`, `released`, `failing`, `casual`, `reproducing`, `established`, `colonising`, `invasive`, `widespreadInvasive`",http://www.w3.org/1999/02/22-rdf-syntax-ns#Property
description,ObjectGroup,ltc:description,http://rs.tdwg.org/ltc/terms/description,http://rs.tdwg.org/ltc/terms/version/description-2023-08-01,Description,A free text description or narrative about the collection.,,"Use this field to record information about the collection in a human-readable, narrative style to introduce the main characteristics of the collection to someone unfamiliar to it. It may include additional information or re-state information held elsewhere in the collection description record - for example, for more atomic, categorised textual descriptions and narratives the MeasurementOrFact class should be used.","`The Chicago Academy of Sciences holds material documenting the biodiversity of Midwest / Western Great Lakes region from the 1830s to the present, and includes comparative and historic material collected across North America. These collections include zoology, botany, earth sciences, cultural, audiovisual, and archives. The institutional collection code CHAS was used historically to reference vertebrate and malacology collections at the Academy and was designated as the primary collection code for all the collections.`",http://www.w3.org/1999/02/22-rdf-syntax-ns#Property
discipline,ObjectGroup,ltc:discipline,http://rs.tdwg.org/ltc/terms/discipline,http://rs.tdwg.org/ltc/terms/version/discipline-2023-08-01,Discipline,A high level classification of the scientific discipline to which the objects within the collection belong or are related.,,"The recommendation is to use a controlled vocabulary that is also common across other community collections, object and occurrence standards. Suggested list https://confluence.egi.eu/display/EGIG/Scientific+Disciplines","`Anthropology`, `Botany`, `Extraterrestrial`, `Geology`, `Microorganisms`, `Other geo/biodiversity`, `Palaeontology`, `Virology`, `Zoology invertebrates`, `Zoology vertebrates`, `Unspecified`",http://www.w3.org/1999/02/22-rdf-syntax-ns#Property
hasChronometricAge,ObjectGroup,ltc:hasChronometricAge,http://rs.tdwg.org/ltc/terms/hasChronometricAge,http://rs.tdwg.org/ltc/terms/version/hasChronometricAge-2023-08-01,Has Chronometric Age,This property refers to one or more related instances of the ChronometricAge class.,,,,http://www.w3.org/1999/02/22-rdf-syntax-ns#Property
hasCollectionStatusHistory,ObjectGroup,ltc:hasCollectionStatusHistory,http://rs.tdwg.org/ltc/terms/hasCollectionStatusHistory,http://rs.tdwg.org/ltc/terms/version/hasCollectionStatusHistory-2023-08-01,Has Collection Status History,This property refers to one or more related instances of the CollectionStatusHistory class.,,,,http://www.w3.org/1999/02/22-rdf-syntax-ns#Property
hasEcologicalContext,ObjectGroup,ltc:hasEcologicalContext,http://rs.tdwg.org/ltc/terms/hasEcologicalContext,http://rs.tdwg.org/ltc/terms/version/hasEcologicalContext-2023-08-01,Has Ecological Context,This property refers to one or more related instances of the EcologicalContext class.,,,,http://www.w3.org/1999/02/22-rdf-syntax-ns#Property
hasEvent,ObjectGroup,ltc:hasEvent,http://rs.tdwg.org/ltc/terms/hasEvent,http://rs.tdwg.org/ltc/terms/version/hasEvent-2023-08-01,Has Event,This property refers to one or more related instances of the Event class.,,,,http://www.w3.org/1999/02/22-rdf-syntax-ns#Property
hasGeographicContext,ObjectGroup,ltc:hasGeographicContext,http://rs.tdwg.org/ltc/terms/hasGeographicContext,http://rs.tdwg.org/ltc/terms/version/hasGeographicContext-2023-08-01,Has Geographic Context,This property refers to one or more related instances of the GeographicContext class.,,,,http://www.w3.org/1999/02/22-rdf-syntax-ns#Property
hasGeologicalContext,ObjectGroup,ltc:hasGeologicalContext,http://rs.tdwg.org/ltc/terms/hasGeologicalContext,http://rs.tdwg.org/ltc/terms/version/hasGeologicalContext-2023-08-01,Has Geological Context,This property refers to one or more related instances of the GeologicalContext class.,,,,http://www.w3.org/1999/02/22-rdf-syntax-ns#Property
hasIdentifier,ObjectGroup,ltc:hasIdentifier,http://rs.tdwg.org/ltc/terms/hasIdentifier,http://rs.tdwg.org/ltc/terms/version/hasIdentifier-2023-08-01,Has Identifier,This property refers to one or more related instances of the Identifier class.,,,,http://www.w3.org/1999/02/22-rdf-syntax-ns#Property
hasMeasurementOrFact,ObjectGroup,ltc:hasMeasurementOrFact,http://rs.tdwg.org/ltc/terms/hasMeasurementOrFact,http://rs.tdwg.org/ltc/terms/version/hasMeasurementOrFact-2023-08-01,Has Measurement Or Fact,This property refers to one or more related instances of the MeasurementOrFact class.,,,,http://www.w3.org/1999/02/22-rdf-syntax-ns#Property
hasObjectClassification,ObjectGroup,ltc:hasObjectClassification,http://rs.tdwg.org/ltc/terms/hasObjectClassification,http://rs.tdwg.org/ltc/terms/version/hasObjectClassification-2023-08-01,Has Object Classification,This property refers to one or more related instances of the ObjectClassification class.,,,,http://www.w3.org/1999/02/22-rdf-syntax-ns#Property
hasOrganisationalUnit,ObjectGroup,ltc:hasOrganisationalUnit,http://rs.tdwg.org/ltc/terms/hasOrganisationalUnit,http://rs.tdwg.org/ltc/terms/version/hasOrganisationalUnit-2023-08-01,Has Organisational Unit,This property refers to one or more related instances of the OrganisationalUnit class.,,,,http://www.w3.org/1999/02/22-rdf-syntax-ns#Property
hasPersonRole,ObjectGroup,ltc:hasPersonRole,http://rs.tdwg.org/ltc/terms/hasPersonRole,http://rs.tdwg.org/ltc/terms/version/hasPersonRole-2023-08-01,Has Person Role,This property refers to one or more related instances of the PersonRole class.,,,,http://www.w3.org/1999/02/22-rdf-syntax-ns#Property
hasReference,ObjectGroup,ltc:hasReference,http://rs.tdwg.org/ltc/terms/hasReference,http://rs.tdwg.org/ltc/terms/version/hasReference-2023-08-01,Has Reference,This property refers to one or more related instances of the Reference class.,,,,http://www.w3.org/1999/02/22-rdf-syntax-ns#Property
hasResourceRelationship,ObjectGroup,ltc:hasResourceRelationship,http://rs.tdwg.org/ltc/terms/hasResourceRelationship,http://rs.tdwg.org/ltc/terms/version/hasResourceRelationship-2023-08-01,Has Resource Relationship,This property refers to one or more related instances of the ResourceRelationship class.,,,,http://www.w3.org/1999/02/22-rdf-syntax-ns#Property
hasStorageLocation,ObjectGroup,ltc:hasStorageLocation,http://rs.tdwg.org/ltc/terms/hasStorageLocation,http://rs.tdwg.org/ltc/terms/version/hasStorageLocation-2023-08-01,Has Storage Location,This property refers to one or more related instances of the StorageLocation class.,,,,http://www.w3.org/1999/02/22-rdf-syntax-ns#Property
hasTaxon,ObjectGroup,ltc:hasTaxon,http://rs.tdwg.org/ltc/terms/hasTaxon,http://rs.tdwg.org/ltc/terms/version/hasTaxon-2023-08-01,Has Taxon,This property refers to one or more related instances of the Taxon class.,,,,http://www.w3.org/1999/02/22-rdf-syntax-ns#Property
isCurrentCollection,ObjectGroup,ltc:isCurrentCollection,http://rs.tdwg.org/ltc/terms/isCurrentCollection,http://rs.tdwg.org/ltc/terms/version/isCurrentCollection-2023-08-01,Is Current Collection,A flag to indicate whether the collection still exists as a single entity.,,Use this to indicate if the record describes the entirety of a known historical collection. If only part of the collection is present the value is 'false'.,`true` `false`,http://www.w3.org/1999/02/22-rdf-syntax-ns#Property
isKnownToContainTypes,ObjectGroup,ltc:isKnownToContainTypes,http://rs.tdwg.org/ltc/terms/isKnownToContainTypes,http://rs.tdwg.org/ltc/terms/version/isKnownToContainTypes-2023-08-01,Is Known To Contain Types,Flag property to indicate that the collection is known to include type specimens.,,`true` - this collection contains types; `false` - this collections does not contain types,`true` `false`,http://www.w3.org/1999/02/22-rdf-syntax-ns#Property
material,ObjectGroup,ltc:material,http://rs.tdwg.org/ltc/terms/material,http://rs.tdwg.org/ltc/terms/version/material-2023-08-01,Material,"Material denotes the raw substance(s) from which the object is formed, in whole or in part.",,"This definition maps roughly to the concept of E57 'material' from the CIDOC CRM: https://cidoc-crm.org/Entity/E57-Material/version-7.1.1. The object, or artefact could contain biological parts, for example jewellery made of amber with insects in, or cloaks made of bird feathers. It should not be used for taxonomic identifications.","`Biological body`, `Organism material (cp. objectType = `Organism product`)`, `Viable cells`, `Protein`, `RNA`, `DNA`, etc.",http://www.w3.org/1999/02/22-rdf-syntax-ns#Property
objectType,ObjectGroup,ltc:objectType,http://rs.tdwg.org/ltc/terms/objectType,http://rs.tdwg.org/ltc/terms/version/objectType-2023-08-01,Object Type,High-level terms for the classification of curated objects.,A more generic classification of items in the collection than described in preparationType.,"Hands-on, practical attributes classifying the stored curated objects. You will expect to find these kinds and types of objects when you go to and access their storage location. This should not be used for classifying objects by taxon. The best way to do that is to use the Taxon class (formal taxonomy and vernacular names) or ObjectClassification class (informal classification).","if baseTypeOfObjectGroup = `MaterialEntity`: `Specimen`, `Tissue`, `Culture`, `HTS Library`, `Lysate`, `Environmental sample`, `Extracted/Preserved DNA/RNA`, `Microscope slide`, `Spore print`, `Macrofossil`, `Mesofossil`, `Microfossil`, `Oversized fossil`; if typeOfObjectGroup = `Non-biological`: `Macro-object`, `Micro-object`, `Oversized object`, `Cut/polished gemstone`, `Core`, `Fluid`, `Hazardous material/object`, `Mixed`; if baseTypeOfObjectGroup = `InformationArtefact`: `Text`, `Audio`, `Visual`",http://www.w3.org/1999/02/22-rdf-syntax-ns#Property
period,ObjectGroup,ltc:period,http://rs.tdwg.org/ltc/terms/period,http://rs.tdwg.org/ltc/terms/version/period-2023-08-01,Period,Used to describe prehistoric or historic periods.,Used to describe the prehistoric or historic period from which objects in the collection originated.,"Often used to describe prehistoric or historic periods, but also geopolitical units and activities of settlements are regarded as special cases of Period. However, there are no assumptions about the scale of the associated phenomena. In particular all events are seen as synthetic processes consisting of coherent phenomena. This property maps to the Period class of the CIDOC-CRM conceptual reference model (http://www.cidoc-crm.org/Entity/e4-period/version-7.1.1).","`Neolithic Period`, `Ming Dynasty`, `McCarthy Era`",http://www.w3.org/1999/02/22-rdf-syntax-ns#Property
