term_name,class_name,term_ns_name,term_iri,term_version_iri,label,definition,usage,notes,examples,type
GeographicContext,GeographicContext,ltc:GeographicContext,http://rs.tdwg.org/ltc/terms/GeographicContext,http://rs.tdwg.org/ltc/terms/version/GeographicContext-2023-08-01,Geographic Context,"The geographic location from which objects associated with the ObjectGroup were collected, or where an Event took place.",,,,http://www.w3.org/2000/01/rdf-schema#Class
continent,GeographicContext,dwc:continent,http://rs.tdwg.org/dwc/terms/continent,,Continent,The name of the continent in which the Location occurs.,The name of the continent in which the GeographicContext is located.,Based on best practice Getty Thesaurus of Geographic Names. --> http://www.getty.edu/vow/TGNHierarchy?find=&place=&nation=&english=Y&subjectid=7029392. For cultural collections such as economic botany use the Region field to record things like Pacific to replace Oceania.,"`Africa`, `Antarctica`, `Asia`, `Europe`, `North America`, `Oceania`, `South America`",http://www.w3.org/1999/02/22-rdf-syntax-ns#Property
country,GeographicContext,dwc:country,http://rs.tdwg.org/dwc/terms/country,,Country,The name of the country or major administrative unit in which the Location occurs.,The name of the country or major administrative unit in which the GeographicContext is located.,Recommended best practice is to use a controlled vocabulary such as the Getty Thesaurus of Geographic Names,"`Angola`, `Denmark`, `Colombia`, `Españax`",http://www.w3.org/1999/02/22-rdf-syntax-ns#Property
countryCode,GeographicContext,dwc:countryCode,http://rs.tdwg.org/dwc/terms/countryCode,,Country Code,The standard code for the country in which the Location occurs.,The standard code for the country in which the GeographicContext is located.,Recommended best practice is to use an ISO 3166-1-alpha-2 country code.,"`AR`, `SV`",http://www.w3.org/1999/02/22-rdf-syntax-ns#Property
county,GeographicContext,dwc:county,http://rs.tdwg.org/dwc/terms/county,,Second Order Division,"The full, unabbreviated name of the next smaller administrative region than stateProvince (county, shire, department, etc.) in which the Location occurs.","""The full, unabbreviated name of the next smaller administrative region than stateProvince (county, shire, department, etc.) in which the GeographicContext is located.""",Recommended best practice is to use a controlled vocabulary such as the Getty Thesaurus of Geographic Names and to leave this field blank if the Location spans multiple entities at this administrative level or is uncertain.,"`Missoula`, `Los Lagos`, `Mataró`",http://www.w3.org/1999/02/22-rdf-syntax-ns#Property
hasIdentifier,GeographicContext,ltc:hasIdentifier,http://rs.tdwg.org/ltc/terms/hasIdentifier,http://rs.tdwg.org/ltc/terms/version/hasIdentifier-2023-08-01,Has Identifier,This property refers to one or more related instances of the Identifier class.,,,,http://www.w3.org/1999/02/22-rdf-syntax-ns#Property
hasMeasurementOrFact,GeographicContext,ltc:hasMeasurementOrFact,http://rs.tdwg.org/ltc/terms/hasMeasurementOrFact,http://rs.tdwg.org/ltc/terms/version/hasMeasurementOrFact-2023-08-01,Has Measurement Or Fact,This property refers to one or more related instances of the MeasurementOrFact class.,,,,http://www.w3.org/1999/02/22-rdf-syntax-ns#Property
hasReference,GeographicContext,ltc:hasReference,http://rs.tdwg.org/ltc/terms/hasReference,http://rs.tdwg.org/ltc/terms/version/hasReference-2023-08-01,Has Reference,This property refers to one or more related instances of the Reference class.,,,,http://www.w3.org/1999/02/22-rdf-syntax-ns#Property
island,GeographicContext,dwc:island,http://rs.tdwg.org/dwc/terms/island,,Island,The name of the island on or near which the Location occurs.,The name of the island on or near which the GeographicContext is located.,Recommended best practice is to use a controlled vocabulary such as the Getty Thesaurus of Geographic Names.,"`Nosy Be`, `Bikini Atoll`, `Vancouver`, `Viti Levu`, `Zanzibar`",http://www.w3.org/1999/02/22-rdf-syntax-ns#Property
islandGroup,GeographicContext,dwc:islandGroup,http://rs.tdwg.org/dwc/terms/islandGroup,,Island Group,The name of the island group in which the Location occurs.,The name of the island group in which the location occurs.,Recommended best practice is to use a controlled vocabulary such as the Getty Thesaurus of Geographic Names.,"`Alexander Archipelago`, `Archipiélago Diego Ramírez`, `Seychelles`",http://www.w3.org/1999/02/22-rdf-syntax-ns#Property
locality,GeographicContext,dwc:locality,http://rs.tdwg.org/dwc/terms/locality,,Locality,The specific description of the place.,,"Less specific geographic information can be provided in other geographic terms (continent, waterBody). This term may contain information modified from the original to correct perceived errors or standardize the description.","`Bariloche, 25 km NNE via Ruta Nacional 40 (=Ruta 237).`",http://www.w3.org/1999/02/22-rdf-syntax-ns#Property
municipality,GeographicContext,dwc:municipality,http://rs.tdwg.org/dwc/terms/municipality,,Municipality,"The full, unabbreviated name of the next smaller administrative region than county (city, municipality, etc.) in which the Location occurs. Do not use this term for a nearby named place that does not contain the actual location.","""The full, unabbreviated name of the next smaller administrative region than county (city, municipality, etc.) in which the GeographicContext is located. Do not use this term for a nearby named place that does not contain the actual location.""",Recommended best practice is to use a controlled vocabulary such as the Getty Thesaurus of Geographic Names.,"`Holzminden`, `Araçatuba`, `Ga-Segonyana`",http://www.w3.org/1999/02/22-rdf-syntax-ns#Property
region,GeographicContext,ltc:region,http://rs.tdwg.org/ltc/terms/region,http://rs.tdwg.org/ltc/terms/version/region-2023-08-01,Region,The name of a spatial region or named place of any size within an individual or multiple administrative areas.,,"Recommended best practice is to use this field in situations where the administrative location fields (country, stateProvince, county, etc.) provide insufficient description. For geological collections examples include basins, provinces, and fossil deposits.","Multi-country: `North European Plain`, Multi-state/Province: `Pacific Northwest`, Waterbody: `Southern`, Geological basins and provinces: `Michigan Basin`, `Mazon Creek`, `Bundenbach`",http://www.w3.org/1999/02/22-rdf-syntax-ns#Property
stateProvince,GeographicContext,dwc:stateProvince,http://rs.tdwg.org/dwc/terms/stateProvince,,First Order Division,"The name of the next smaller administrative region than country (state, province, canton, department, region, etc.) in which the Location occurs.","""The name of the next smaller administrative region than country (state, province, canton, department, region, etc.) in which the GeographicContext is located.""",Recommended best practice is to use a controlled vocabulary such as the Getty Thesaurus of Geographic Names and to leave this field blank if the Location spans multiple entities at this administrative level or is uncertain.,"`Montana`, `Minas Gerais`, `Córdoba`",http://www.w3.org/1999/02/22-rdf-syntax-ns#Property
waterBody,GeographicContext,dwc:waterBody,http://rs.tdwg.org/dwc/terms/waterBody,,Water Body,The name of the water body in which the Location occurs.,The name of the water body in which the GeographicContext is located.,"This is intended to define the lowest water body or aquatic feature that defines the geographical constraints of aquatic collections below ocean. Suggestions for appropriate vocabularies include: HydroLAKES (https://www.hydrosheds.org/page/hydrolakes), a database aiming to provide the shoreline polygons of all global lakes with a surface area of at least 10 ha, the 'water body' term in the OBO ontology (http://purl.obolibrary.org/obo/ENVO_00000063) and, for marine water bodies, IHO Sea Areas (http://www.vliz.be/en/imis?dasid=5444&doiid=323).","`Baltic Sea`, `Hudson River`, `Lago Nahuel Huapi`",http://www.w3.org/1999/02/22-rdf-syntax-ns#Property
waterBodyType,GeographicContext,ltc:waterBodyType,http://rs.tdwg.org/ltc/terms/waterBodyType,http://rs.tdwg.org/ltc/terms/version/waterBodyType-2023-08-01,Waterbody Type,A term that indicates the aquatic order of a waterbody.,,"Recommendation is to use a controlled vocabulary, such as those fuind at https://www.usgs.gov/mission-areas/water-resources/science/types-water and https://sciencetrends.com/types-bodies-water-complete-list/.","`Ocean`, `Sea`, `Lake`, `Pond`, `River`",http://www.w3.org/1999/02/22-rdf-syntax-ns#Property
GeologicalContext,GeologicalContext,ltc:GeologicalContext,http://rs.tdwg.org/ltc/terms/GeologicalContext,http://rs.tdwg.org/ltc/terms/version/GeologicalContext-2023-08-01,Geological Context,"Geological information, such as stratigraphy, that qualifies a region or place.",,,,http://www.w3.org/2000/01/rdf-schema#Class
bed,GeologicalContext,dwc:bed,http://rs.tdwg.org/dwc/terms/bed,,Bed,The full name of the lithostratigraphic bed from which the cataloged item was collected.,The full name of the lithostratigraphic bed from which the objects in the collection originated.,Recommended vocabulary: https://ngmdb.usgs.gov/Geolex/search,"`Beecher Trilobite Bed`, `McAbee Fossil Beds`, `Ashfall Fossil Beds`, `Nut Beds`",http://www.w3.org/1999/02/22-rdf-syntax-ns#Property
earliestAgeOrLowestStage,GeologicalContext,dwc:earliestAgeOrLowestStage,http://rs.tdwg.org/dwc/terms/earliestAgeOrLowestStage,,Earliest Age Or Lowest Stage,The full name of the earliest possible geochronologic age or lowest chronostratigraphic stage attributable to the stratigraphic horizon from which the cataloged item was collected.,The full name of the earliest possible geochronologic age or lowest chronostratigraphic stage attributable to the stratigraphic horizon from which objects in the collection originated.,"Recommended vocabularies: https://stratigraphy.org/chart, https://timescalefoundation.org/resources/geowhen/index.html","`Atlantic`, `Boreal`, `Frasnian`, `Hirnantian`, `Maastrichtian`, `Bridgerian`",http://www.w3.org/1999/02/22-rdf-syntax-ns#Property
earliestEonOrLowestEonothem,GeologicalContext,dwc:earliestEonOrLowestEonothem,http://rs.tdwg.org/dwc/terms/earliestEonOrLowestEonothem,,Earliest Eon Or Lowest Eonothem,The full name of the earliest possible geochronologic eon or lowest chrono-stratigraphic eonothem or the informal name (Precambrian) attributable to the stratigraphic horizon from which the cataloged item was collected.,The full name of the earliest possible geochronologic eon or lowest chrono-stratigraphic eonothem or the informal name (Precambrian) attributable to the stratigraphic horizon from which the objects in the collection originated.,"Recommended vocabularies: https://stratigraphy.org/chart, https://timescalefoundation.org/resources/geowhen/index.html","`Phanerozoic`, `Proterozoic`, `Arechean`, `Hadean`",http://www.w3.org/1999/02/22-rdf-syntax-ns#Property
earliestEpochOrLowestSeries,GeologicalContext,dwc:earliestEpochOrLowestSeries,http://rs.tdwg.org/dwc/terms/earliestEpochOrLowestSeries,,Earliest Epoch Or Lowest Series,The full name of the earliest possible geochronologic epoch or lowest chronostratigraphic series attributable to the stratigraphic horizon from which the cataloged item was collected.,The full name of the earliest possible geochronologic epoch or lowest chronostratigraphic series attributable to the stratigraphic horizon from which objects in the collection originated.,"Recommended vocabularies: https://stratigraphy.org/chart, https://timescalefoundation.org/resources/geowhen/index.html","`Holocene`, `Pleistocene`, `Ibexian`, `Late Devonian`",http://www.w3.org/1999/02/22-rdf-syntax-ns#Property
earliestEraOrLowestErathem,GeologicalContext,dwc:earliestEraOrLowestErathem,http://rs.tdwg.org/dwc/terms/earliestEraOrLowestErathem,,Earliest Era Or Lowest Erathem,The full name of the earliest possible geochronologic era or lowest chronostratigraphic erathem attributable to the stratigraphic horizon from which the cataloged item was collected.,The full name of the earliest possible geochronologic era or lowest chronostratigraphic erathem attributable to the stratigraphic horizon from which the objects in the collection originated.,"Recommended vocabularies: https://stratigraphy.org/chart, https://timescalefoundation.org/resources/geowhen/index.html","`Cenozoic`, `Mesozoic`, `Paleozoic`, `Neoproterozoic`",http://www.w3.org/1999/02/22-rdf-syntax-ns#Property
earliestPeriodOrLowestSystem,GeologicalContext,dwc:earliestPeriodOrLowestSystem,http://rs.tdwg.org/dwc/terms/earliestPeriodOrLowestSystem,,Earliest Period Or Lowest System,The full name of the earliest possible geochronologic period or lowest chronostratigraphic system attributable to the stratigraphic horizon from which the cataloged item was collected.,The full name of the earliest possible geochronologic period or lowest chronostratigraphic system attributable to the stratigraphic horizon from which objects in the collection originated.,"Recommended vocabularies: https://stratigraphy.org/chart, https://timescalefoundation.org/resources/geowhen/index.html","`Neogene`, `Quaternary`, `Jurassic`, `Devonian`",http://www.w3.org/1999/02/22-rdf-syntax-ns#Property
formation,GeologicalContext,dwc:formation,http://rs.tdwg.org/dwc/terms/formation,,Formation,The full name of the lithostratigraphic formation from which the cataloged item was collected.,The full name of the lithostratigraphic formation from which objects in the collection originated.,Recommended vocabulary: https://ngmdb.usgs.gov/Geolex/search,"`Notch Peak Formation`, ` House Limestone`, `Fillmore Formation`, `Redwall Limestone`",http://www.w3.org/1999/02/22-rdf-syntax-ns#Property
group,GeologicalContext,dwc:group,http://rs.tdwg.org/dwc/terms/group,,Group,The full name of the lithostratigraphic group from which the cataloged item was collected.,The full name of the lithostratigraphic group from which the objects in the collection originated.,Recommended vocabulary: https://ngmdb.usgs.gov/Geolex/search,"`Bathurst`, `Wealden`, `Elk Mound`, `Supai`",http://www.w3.org/1999/02/22-rdf-syntax-ns#Property
hasIdentifier,GeologicalContext,ltc:hasIdentifier,http://rs.tdwg.org/ltc/terms/hasIdentifier,http://rs.tdwg.org/ltc/terms/version/hasIdentifier-2023-08-01,Has Identifier,This property refers to one or more related instances of the Identifier class.,,,,http://www.w3.org/1999/02/22-rdf-syntax-ns#Property
hasMeasurementOrFact,GeologicalContext,ltc:hasMeasurementOrFact,http://rs.tdwg.org/ltc/terms/hasMeasurementOrFact,http://rs.tdwg.org/ltc/terms/version/hasMeasurementOrFact-2023-08-01,Has Measurement Or Fact,This property refers to one or more related instances of the MeasurementOrFact class.,,,,http://www.w3.org/1999/02/22-rdf-syntax-ns#Property
hasReference,GeologicalContext,ltc:hasReference,http://rs.tdwg.org/ltc/terms/hasReference,http://rs.tdwg.org/ltc/terms/version/hasReference-2023-08-01,Has Reference,This property refers to one or more related instances of the Reference class.,,,,http://www.w3.org/1999/02/22-rdf-syntax-ns#Property
latestAgeOrHighestStage,GeologicalContext,dwc:latestAgeOrHighestStage,http://rs.tdwg.org/dwc/terms/latestAgeOrHighestStage,,Latest Age Or Highest Stage,The full name of the latest possible geochronologic age or highest chronostratigraphic stage attributable to the stratigraphic horizon from which the cataloged item was collected.,The full name of the latest possible geochronologic age or highest chronostratigraphic stage attributable to the stratigraphic horizon from which objects in the collection originated.,"Recommended vocabularies: https://stratigraphy.org/chart, https://timescalefoundation.org/resources/geowhen/index.html","`Atlantic`, `Boreal`",http://www.w3.org/1999/02/22-rdf-syntax-ns#Property
latestEonOrHighestEonothem,GeologicalContext,dwc:latestEonOrHighestEonothem,http://rs.tdwg.org/dwc/terms/latestEonOrHighestEonothem,,Latest Eon Or Highest Eonothem,The full name of the latest possible geochronologic eon or highest chrono-stratigraphic eonothem or the informal name (Precambrian) attributable to the stratigraphic horizon from which the cataloged item was collected.,The full name of the latest possible geochronologic eon or highest chrono-stratigraphic eonothem or the informal name (Precambrian) attributable to the stratigraphic horizon from which the objects in the collection originated.,"Recommended vocabularies: https://stratigraphy.org/chart, https://timescalefoundation.org/resources/geowhen/index.html","`Phanerozoic`, `Proterozoic`",http://www.w3.org/1999/02/22-rdf-syntax-ns#Property
latestEpochOrHighestSeries,GeologicalContext,dwc:latestEpochOrHighestSeries,http://rs.tdwg.org/dwc/terms/latestEpochOrHighestSeries,,Latest Epoch Or Highest Series,The full name of the latest possible geochronologic epoch or highest chronostratigraphic series attributable to the stratigraphic horizon from which the cataloged item was collected.,The full name of the latest possible geochronologic epoch or highest chronostratigraphic series attributable to the stratigraphic horizon from which objects in the collection originated.,"Recommended vocabularies: https://stratigraphy.org/chart, https://timescalefoundation.org/resources/geowhen/index.html","`Holocene`, `Pleistocene`",http://www.w3.org/1999/02/22-rdf-syntax-ns#Property
latestEraOrHighestErathem,GeologicalContext,dwc:latestEraOrHighestErathem,http://rs.tdwg.org/dwc/terms/latestEraOrHighestErathem,,Latest Era Or Highest Erathem,The full name of the latest possible geochronologic era or highest chronostratigraphic erathem attributable to the stratigraphic horizon from which the cataloged item was collected.,The full name of the latest possible geochronologic era or highest chronostratigraphic erathem attributable to the stratigraphic horizon from which objects in the collection originated.,"Recommended vocabularies: https://stratigraphy.org/chart, https://timescalefoundation.org/resources/geowhen/index.html","`Cenozoic`, `Mesozoic`",http://www.w3.org/1999/02/22-rdf-syntax-ns#Property
latestPeriodOrHighestSystem,GeologicalContext,dwc:latestPeriodOrHighestSystem,http://rs.tdwg.org/dwc/terms/latestPeriodOrHighestSystem,,Latest Period Or Highest System,The full name of the latest possible geochronologic period or highest chronostratigraphic system attributable to the stratigraphic horizon from which the cataloged item was collected.,The full name of the latest possible geochronologic period or highest chronostratigraphic system attributable to the stratigraphic horizon from which objects in the collection originated.,"Recommended vocabularies: https://stratigraphy.org/chart, https://timescalefoundation.org/resources/geowhen/index.html","`Neogene`, `Tertiary`, `Quaternary`",http://www.w3.org/1999/02/22-rdf-syntax-ns#Property
member,GeologicalContext,dwc:member,http://rs.tdwg.org/dwc/terms/member,,Member,The full name of the lithostratigraphic member from which the cataloged item was collected.,The full name of the lithostratigraphic member from which objects in the collection originated.,Recommend vocabulary: https://ngmdb.usgs.gov/Geolex/search,"`Lava Dam Member`, `Hellnmaria Member`, `Francis Creek Shale`",http://www.w3.org/1999/02/22-rdf-syntax-ns#Property
supergroup,GeologicalContext,ltc:supergroup,http://rs.tdwg.org/ltc/terms/supergroup,http://rs.tdwg.org/ltc/terms/version/supergroup-2023-08-01,Supergroup,The full name of the lithostratigraphic supergroup from which the cataloged item was collected.,A supergroup is a formal assemblage of related or superposed groups or of groups and formations. Such units have proved useful in regional and provincial syntheses. Supergroups should be named only where their recognition serves a clear purpose.,Recommended vocabulary. At time of inclusion this term is in progress of being included as part of dwc tdwg/dwc#234,"`Karoe`, `Cape`",http://www.w3.org/1999/02/22-rdf-syntax-ns#Property
Identifier,Identifier,ltc:Identifier,http://rs.tdwg.org/ltc/terms/Identifier,http://rs.tdwg.org/ltc/terms/version/Identifier-2023-08-01,Identifier,"A numeric, textual value, or reference such as an IRI, that can be used to uniquely identify the object to which it is attached.",,"Use this class to document stable identifiers that describe the collections and associated entities being represented in the collection description. For example, person identifiers, taxon identifiers, institution identifiers, organisational unit identifiers, gazetteer identifiers. Identifiers represented by this class may be globally unique, or unique within a given context.",,http://www.w3.org/2000/01/rdf-schema#Class
hasReference,Identifier,ltc:hasReference,http://rs.tdwg.org/ltc/terms/hasReference,http://rs.tdwg.org/ltc/terms/version/hasReference-2023-08-01,Has Reference,This property refers to one or more related instances of the Reference class.,,,,http://www.w3.org/1999/02/22-rdf-syntax-ns#Property
identifierSource,Identifier,ltc:identifierSource,http://rs.tdwg.org/ltc/terms/identifierSource,http://rs.tdwg.org/ltc/terms/version/identifierSource-2023-08-01,Identifier Source,The source or creator of the identifier.,,"This term refers to the organisation, framework, software or database that minted the identifier represented in the identifier property.","`Index Herbariorum`, `GBIF Registry of Scientific Collections (GRSciColl)`, `CITES`, `IPEN`, `NHM UK 'Join the Dots' framework`",http://www.w3.org/1999/02/22-rdf-syntax-ns#Property
identifierType,Identifier,ltc:identifierType,http://rs.tdwg.org/ltc/terms/identifierType,http://rs.tdwg.org/ltc/terms/version/identifierType-2023-08-01,Identifier Type,The type and format of the value in the identifier field.,,This property should be used to help people and software understand how the identifier can be used (e.g. whether it's a resolvable URI) and validate the identifier based on format and composition (e.g. a valid UUID).,"`Acronym`, `URI`, `UUID v4`",http://www.w3.org/1999/02/22-rdf-syntax-ns#Property
identifierValue,Identifier,ltc:identifierValue,http://rs.tdwg.org/ltc/terms/identifierValue,http://rs.tdwg.org/ltc/terms/version/identifierValue-2023-08-01,Identifier,"A textual or numeric identifier, acronym or URI that provides an unambiguous reference for an entity within a given context.",,"This may be a simple value or resolvable URI, and can reflect any identifier used to identify an entity (such as a collection, taxon, institution or person) included in the Collection Description.","`http://grscicoll.org/institutional-collection/osteology`, `https://www.gbif.org/grscicoll/collection/64232ca4-fd5a-4a3d-a1d5-ef812107472c`, `https://www.gbif.org/grscicoll/institution/52827361-5e82-43b7-b92a-f6ad98367fa5`, `http://sweetgum.nybg.org/science/ih/herbarium-details/?irn=126969`, `10.5072/example-full`, `NHMUK-Verts`, `BGBM`",http://www.w3.org/1999/02/22-rdf-syntax-ns#Property
LatimerCoreScheme,LatimerCoreScheme,ltc:LatimerCoreScheme,http://rs.tdwg.org/ltc/terms/LatimerCoreScheme,http://rs.tdwg.org/ltc/terms/version/LatimerCoreScheme-2023-08-01,Latimer Core Scheme,"A grouping of multiple ObjectGroups for a particular use case, purpose or implementation.",,"Where the same objects within the same collection might be described by more than one ObjectGroup for different purposes (for examples, a 'Darwin Fossil Mammals' collection description might overlap with a 'Offsite Palaeontology' collection description), this class can be used to distinguish between them and avoid double-counting of metrics in queries against the data.",,http://www.w3.org/2000/01/rdf-schema#Class
basisOfScheme,LatimerCoreScheme,ltc:basisOfScheme,http://rs.tdwg.org/ltc/terms/basisOfScheme,http://rs.tdwg.org/ltc/terms/version/basisOfScheme-2023-08-01,Basis Of Scheme,A summary of the basis or purpose for the LatimerCoreScheme.,,"This property is intended to summarise the reason for grouping a number of ObjectGroups within the LatimerCoreScheme, and the purpose for which the data is intended to be used. This may also be reflected in the terms and metrics defined using the SchemeTerm and SchemeMeasurementOrFact classes respectively. Using this approach, standard and reusable profiles within the wider Latimer Core standard may be constructed for common collection descriptions use cases.","`Accession`, `Inventory`, `Expedition`, `Digitisation planning`, `Collections assessment`, `Institution`, `Collections registry`",http://www.w3.org/1999/02/22-rdf-syntax-ns#Property
hasIdentifier,LatimerCoreScheme,ltc:hasIdentifier,http://rs.tdwg.org/ltc/terms/hasIdentifier,http://rs.tdwg.org/ltc/terms/version/hasIdentifier-2023-08-01,Has Identifier,This property refers to one or more related instances of the Identifier class.,,,,http://www.w3.org/1999/02/22-rdf-syntax-ns#Property
hasObjectGroup,LatimerCoreScheme,ltc:hasObjectGroup,http://rs.tdwg.org/ltc/terms/hasObjectGroup,http://rs.tdwg.org/ltc/terms/version/hasObjectGroup-2023-08-01,Has Object Group,This property refers to one or more related instances of the ObjectGroup class.,,,,http://www.w3.org/1999/02/22-rdf-syntax-ns#Property
hasReference,LatimerCoreScheme,ltc:hasReference,http://rs.tdwg.org/ltc/terms/hasReference,http://rs.tdwg.org/ltc/terms/version/hasReference-2023-08-01,Has Reference,This property refers to one or more related instances of the Reference class.,,,,http://www.w3.org/1999/02/22-rdf-syntax-ns#Property
hasSchemeMeasurementOrFact,LatimerCoreScheme,ltc:hasSchemeMeasurementOrFact,http://rs.tdwg.org/ltc/terms/hasSchemeMeasurementOrFact,http://rs.tdwg.org/ltc/terms/version/hasSchemeMeasurementOrFact-2023-08-01,Has Scheme Measurement Or Fact,This property refers to one or more related instances of the SchemeMeasurementOrFact class.,,,,http://www.w3.org/1999/02/22-rdf-syntax-ns#Property
